{
  "eventId": "019b1000-0000-7000-8000-000000000001",
  "eventType": "agent-run.requested.v1",
  "schemaVersion": 1,
  "occurredAt": "2026-07-21T13:00:00Z",
  "producer": "platform-api",
  "tenantId": "019b1000-0000-7000-8000-000000000002",
  "projectId": "019b1000-0000-7000-8000-000000000003",
  "runId": "019b1000-0000-7000-8000-000000000004",
  "aggregateType": "AgentRun",
  "aggregateId": "019b1000-0000-7000-8000-000000000004",
  "aggregateVersion": 1,
  "correlationId": "old-command-example",
  "causationId": "old-command-example",
  "payload": {
    "projectId": "019b1000-0000-7000-8000-000000000003",
    "runId": "019b1000-0000-7000-8000-000000000004",
    "status": "QUEUED",
    "attemptNumber": 1,
    "runtime": "python-3.12",
    "cpuMillis": 1000,
    "memoryMiB": 2048,
    "timeoutSeconds": 1800,
    "maxAttempts": 3,
    "promptReference": "vault://prompts/old-example"
  }
}
